emotion_category,has_price,has_info_gap,content_length,photo_quality_score,structured_content_flag,caption_text,image_count,tags,restaurant_name,cuisine_type,restaurant_popularity,novelty_score,raw_price,post_datetime,follower_count,like_count,save_count,comment_count,link,price_avg,price_level,content_length_bucket,engagement_score,is_high_engagement,like_rate,save_rate,comment_rate,weekday,is_weekend,image_count_bucket,image_density
Hybrid,0,1,387,1,1,终于轮到我吃南来北往了，实在是太棒了👏👏 谷歌地图直接搜就有，但英文名是Uncle Zhang Chinese Cuisine，不在中国城里，开车五分钟之内 🌟重要的事先说： 油条和咸豆腐脑只有周六日的下午三点前有‼️其他时间没有 图1/2🥞煎饼果子 实在是太好吃了，我没去过东北，但是在国内其他地方吃的煎饼果子皮都比较厚，这家的饼皮真的超薄，夸张点说比越南春卷的皮还薄，配上鸡蛋，口感特别软嫩！！必须吃！薄脆给的也多！里面刷的酱有种豆瓣酱和甜面酱混合后的口感，酱刷多的地方还是有点咸的，怕咸的小伙伴可以要求刷少点 图3🦴溜双段 只想吃溜肉段，但这家里面是虾仁和猪肉双溜，没办法👐味道没有酸味，就是略微的咸味！猪肉段给的量特别足，一点都不敷衍，纯肉少淀粉干的就是爽！ 图🌱冬菇白菜 特别特别爽口的做法，比其他中餐炒出来的素菜油少勾的芡粉也少。可以选这个当素菜哦 图5🌶️火爆腰花 后厨切菜师傅刀工666，腰花片的特别漂亮。我们吃的这盘腰花稍微有点老，但是味很正。,5,#芝加哥美食 #芝加哥旅游 #芝加哥南来北往 #芝加哥生活 #芝加哥留学 #芝加哥必吃 #一家被找疯了的店 #探店 #芝加哥吃什么 #芝加哥东北菜,Uncle Zhang Chinese Cuisine,Chinese,2,3,nan,2024-01-01,149,398,512,34,芝加哥特产🥤必须来这家店！ - 小红书,,,medium,6.3355704697986575,True,2.6711409395973154,3.436241610738255,0.22818791946308725,Monday,False,small,0.012919896640826873
Hybrid,1,1,410,1,1,在芝加哥吃了七八九十次Volare后找到了替代餐厅🍴 Volare感觉已经吃成了食堂 男朋友每个来芝加哥的朋友都自行订在这个餐厅吃的程度！ 我们吃多了之后现在非常固定就只点烤小海鲜Volare Signature Insalata di Mare（这个烤海鲜发挥非常不稳定 有时候咸的要命）+墨鱼面Spaghetti Neri al Pesce+墨鱼饭Volare Risotti+当日special+提拉米苏和布蕾轮着点 由于我还是看不懂那个菜单 所以我都是照着价格找菜 反正海鲜27意面38焗饭33 倒背如流！ 另外还点过龙虾意面/千层面/red snaper 这三个很普通❌ 黑松露披萨/羊排 推荐☑️ 甜品：目前菜单上所有甜品都吃过 提拉米苏反正每次必点 布蕾很香也推荐 提拉米苏一份够两人吃 布蕾就是一人份 banana bread pudding不是布丁 是软软的面包（我是土狗不知道没吃过）反正我不爱吃 巧克力常规款和special款都很甜 ❌ ⚠️本文重点：volare替代➡️topo gigio（乱讲的因为我只吃过一次 但是我感觉还挺好吃而且比volare便宜） 推荐： 炸鱿鱼（是fritti那个不是alla grilia那个）很大一份 面粉也薄 海鲜烩饭RISOTTO FRUTTI di MARE DELLE MARCHE 巨大一份才30刀 很多蟹肉！奶油口的 贝壳面CONCHIGLIE alla SARDA 辣口的还有青豆 好吃😋 提拉米苏也挺好吃的 ,1,#芝加哥 #芝加哥探店 #芝加哥美食 #芝加哥旅游,Topo Gigio,Italian,3,1,nan,2024-03-10,205,382,484,11,在芝加哥吃了七八九十次Volare后找到了替代餐厅🍴 Volare感觉已经吃成了食堂 男朋友每个来芝加哥的朋友都自行订在这个餐厅吃的程度！ 我们吃多了之后现在非常固定就只点烤小海鲜Volare Signature Insalata di Mare（这个烤海鲜发挥非常不稳定 有时候咸的要命）+墨鱼面Spaghetti Neri al Pesce+墨鱼饭Volare Risotti+当日special+提拉米苏和布蕾轮着点 由于我还是看不懂那个菜单 所以我都是照着价格找菜 反正海鲜27意面38焗饭33 倒背如流！ 另外还点过龙虾意面/千层面/red snaper 这三个很普通❌ 黑松露披萨/羊排 推荐☑️ 甜品：目前菜单上所有甜品都吃过 提拉米苏反正每次必点 布蕾很香也推荐 提拉米苏一份够两人吃 布蕾就是一人份 banana bread pudding不是布丁 是软软的面包（我是土狗不知道没吃过）反正我不爱吃 巧克力常规款和special款都很甜 ❌ ⚠️本文重点：volare替代➡️topo gigio（乱讲的因为我只吃过一次 但是我感觉还挺好吃而且比volare便宜） 推荐： 炸鱿鱼（是fritti那个不是alla grilia那个）很大一份 面粉也薄 海鲜烩饭RISOTTO FRUTTI di MARE DELLE MARCHE 巨大一份才30刀 很多蟹肉！奶油口的 贝壳面CONCHIGLIE alla SARDA 辣口的还有青豆 好吃😋 提拉米苏也挺好吃的 #芝加哥 #芝加哥探店 #芝加哥美食 #芝加哥旅游 - 小红书,,,long,4.278048780487805,True,1.8634146341463416,2.3609756097560974,0.05365853658536585,Sunday,True,small,0.0024390243902439024
Hybrid,0,0,499,1,1,"又是因为拖延症现在才写出来的韩国烤肉/火锅店🥹去年十二月搬家以后很想在周围找点亚洲餐吃，第一个出现的高分review餐厅就是这里了～ 🍄图一到四是店里强烈推荐的蘑菇火锅～里面确实有各式蘑菇，但需要提醒大家的是确实没有太多珍贵的菌种，大部分也是亚洲超市或者farmer’s market能买到的种类。好处是确实用来下火锅很鲜美。店里提供的套餐还可以选择是否加肉，感觉先下蘑菇作为锅底再来煮肉和蔬菜格外好吃，但如果能有中国火锅店的蘸料就更好了。 🍄图五是店里不管点火锅还是烤肉都会送的小菜～ 🍄图六是店里的烤肉套餐～肉的品质要比城里很多家烤肉店好多啦～腌过的肉需要自己动手剪剪，但很入味很棒～ 🍄还点了菜单上的蒸鮟鱇鱼～第一次去没有吃到，因为店家说要提前通知第二次去终于提前点了，但吃起来有点失望，并不是想象中的清蒸，而更像用了韩国泡菜爆炒鱼肉。好吃是好吃，但还是有点不符合预期吧。 因为带着爸妈一起去，所以被店家当做了韩国人热情的讲韩文（？）第二次去正好是圣诞节，他们却还是正常开门，不愧是认真工作的亚裔。话说第一次去吃火锅没吃完，他们跟我说打包盒要收费，但第二次没遇到这种情况，不知道为什么政策会不consistent，大家留意一下吧。 Chicago Galbi House：340 W Half Day Rd, Buffalo Grove, IL 60089",6,#爱吃的夏天喵 #奔赴一场冬日火锅局 #芝加哥探店 #芝加哥 #芝加哥美食 #芝加哥生活 #冬天的第一顿火锅 #菌子火锅 #地球村食评人大赛 #美洲狂欢角,Chicago Galbi House,Korean,1,1,nan,2025-08-04,3998,229,224,12,芝加哥郊区菌子火锅—Chicago Galbi House - 小红书,,,long,0.11630815407703853,False,0.05727863931965983,0.0560280140070035,0.0030015007503751876,Monday,False,small,0.012024048096192385
Hybrid,0,0,219,1,0,回国一个月郎了三次后念念不忘。。上周发现south loop和中国城都有回转寿司—老己必须火速来品尝尝尝。 没想到超惊喜！最喜欢的是火炙虾寿司！！图片里红盘子的那个也挺好吃的！还有一款白色的鱼上面有黑松露的也好吃！ 小食的话推荐天妇罗—超大一份，蔬菜炸的很香。 烤鱼非常嫩+入味，也很值得点。有人说软壳蟹有点腥味，但是我沾了酱油+柠檬汁完全没觉得。 不建议点焦糖布蕾-太大一份了，三个人都吃不完。 寿司炸物吃多了腻，但是他家茉莉花茶超级好喝哦！ 完全不用点可乐！！就喝茶 ,6, #芝加哥 #芝加哥探店 #芝加哥中餐 #芝加哥大学 #芝加哥中寿司 #团仔带你吃喝玩乐  #饭团外卖11周年 #回转寿司 #芝加哥大学,SushiPlus,Japanese,1,1,nan,2026-01-21,1478,228,136,39,芝加哥终于可以郎一下！回转寿司吃到爽了！ - 小红书,,,medium,0.27266576454668473,False,0.15426251691474965,0.09201623815967523,0.02638700947225981,Wednesday,False,small,0.0273972602739726
Hybrid,0,0,402,1,1,"自从疫情开始，我超爱的taco店就只做外卖了。前段时间听朋友说他们的其中一家店重新开堂食了，就立刻安排了早餐。 🌮图一就是大名鼎鼎的周末特供牛肚汤Menudo（发音也真的像焖牛肚！）香辣牛肚浸泡在热乎乎的汤中，店员还会用磕磕绊绊的英文询问客人是否想在牛肚汤加蹄子，那必然是要加的！一口下去都是满满的胶原蛋白的胶质感～ 🌮图二是店里的炸猪皮，也是给等位的客人们的小零食。 🌮图三四五是店里的猪肉，可以按磅购买。猪肉的各个部分都有（不过好像没见到过大小肠），而且如果有不喜欢的部位可以告诉服务生，比如猪皮之类的。肉上桌后可以用玉米饼和图六的青红莎莎酱以及洋葱香菜自行搭配。 🌮图八是conrunda，算是墨西哥粽子（tamale的一种）。店里提供芝士和芝士+菠菜两种馅料的conrunda，外带酸奶油，芝士和辣酱三种不同topping加在上面吃。 Carnitas Uruapan一共有两家，我去的是55街那家，地方相对大一些，而且也相对干净。不过如果只是打包带回家吃的话，18街的会相对近一些。 Carnitas Uruapan：2813 W 55th St, Chicago, IL 60632 ",9,#爱吃的夏天喵 #全球吃喝小分队 #芝加哥生活 #芝加哥美食 #芝加哥探店 #墨西哥牛肚汤 #美食日常 #我的美食日记 #芝加哥 #全球吃喝小分队,Carnitas Uruapan,Mexico,1,2,nan,2024-04-29,3998,522,487,10,芝加哥｜提神醒脑牛肚汤—Carnitas Uruapan - 小红书,,,long,0.2548774387193597,False,0.13056528264132067,0.12181090545272637,0.0025012506253126563,Monday,False,medium,0.022388059701492536
Hybrid,0,1,484,1,1,被称作汉堡天花板的Au Cheval 算得上是芝加哥最火最有名的餐厅之一了，这次终于来吃了[亲一个R] . 🍳Foie & Scramble Egg 鹅肝滑蛋 🌟🌟🌟🌟🌟 滑蛋加入了大量黄油，嫩滑细腻，奶香十足[亲一个R]。顶部大块的鹅肝混合焦糖洋葱酱，微甜带出丰润脂香。全部放在用黄油煎过的外脆内软的吐司上，吐司被酱汁微微浸润，吃一口就原谅了他的热量[超喜欢R] 🍔Double Cheese Burger + Egg + Bacon 满级汉堡 🌟🌟🌟🌟🌟 三层牛肉饼+流心煎蛋+厚切培根，看得让人瞳孔地震[心心眼R] 快准狠的一下把鸡蛋盖上，蛋黄爆破，随着肉汁不断流下，饭张力拉满！[心心眼R][心心眼R][心心眼R] 汉堡要上手才有灵魂嘛！准备好张大嘴，一口下去，松软香甜的布里欧修面包夹着焦脆多汁的牛肉饼与足以擦边叉烧的培根，黄油芝士的浓香与培根牛肉的荤香由着蛋黄瞬间充满口腔，香气极具爆发力，又因为酸黄瓜与酱汁不会让人觉得油腻，真是具有欺骗性的让人觉得热量不高[超喜欢R] 🍰Mille-Feuille 拿破仑 🌟🌟🌟✨ 小山一般高的拿破仑，酥皮层层分明，轻轻一敲便碎得得干脆利落。夹层奶油打得偏硬，冰冰凉凉，肉眼可见的香草籽用料实在，奶甜不腻，但吃几口还是蛮顶的 点了半份Green Salad实在是太酸了，酸到腻[嘻嘻R] . 只有walk-in，我们是周末11点半到的，等了大概10分钟，不算太慢 ,11,#地球村食评人大赛 #心头好美食拯救计划 #小城绝世小神店 #值得为吃而去的小城 #古早way #食堂解密者 #市井食探 #美洲狂欢角 @吃货薯 #圆周旅迹 #J人旅行指南,Au Cheval ,America,3,1,nan,2025-04-24,5123,350,346,18,芝加哥｜汉堡天花板🍔 - 小红书,,,long,0.13937146203396447,False,0.06831934413429631,0.06753855162990435,0.0035135662697638103,Thursday,False,medium,0.022727272727272728
Hybrid,0,0,158,1,0,他家真的可以和Volare打一打🥹 他家的海鲜饭真的很绝！里面满满蟹肉，可以平替一下我们江浙沪的梭子蟹拌饭，料比饭多谁懂啊！！ fried calamari也是一绝，脆皮裹的好轻盈，鱿鱼超新鲜！ 当日限定的白巧克力树莓蛋糕看起来来普普但味道真的很绝，朴实又好吃 每日的汤味道也不错，盲点不踩雷 提拉米苏警察表示所有人推荐的提拉米苏感觉倒是不太好吃，没什么必要点 ,10,#意大利菜 #芝加哥美食推荐,Topo Gigio,Italian,3,1,nan,2024-08-11,1231,808,1180,35,芝加哥｜Topo Gigio封神蟹肉海鲜饭 - 小红书,,,short,1.6433793663688059,True,0.6563769293257514,0.958570268074736,0.02843216896831844,Sunday,True,medium,0.06329113924050633
Hybrid,0,0,369,1,1,"周末打完球来吃了这家最近芝加哥很火的泰餐。门店小小的，看着很像家庭餐厅👪 店里没有在等的客人，但是收桌子收了40分钟，慢到我都想冲上去帮他收桌子了 anyway 推荐几个我觉得很好吃的特色菜 前菜 🥗 Sun Dried Beef：微咸牛肉干，梦回国内小食街。搭配甜酸酱，一秒再穿越泰国🇹🇭 Fried Fish Ball：学校校门口的味道！鱼丸是那种老式鱼丸的味道，鲜味很浓郁 主食 🍛 Duck Red Curry：巨爱❤️个人觉得比榴莲咖喱好吃！酥脆鸭肉搭配荔枝真的很神奇，有点咸有点甜，不会腻的口感。咖喱汁拌饭可以吃一大碗碳水🍚 Durian Massanmun Curry：卖点应该是在美国不太常吃到的榴莲，是好吃的！因为很难想到榴莲和咖喱的组合所以没有正确的期待你就会被经验到。榴莲是甜糯糯的，没有吃到冷冻硬邦邦的口感 甜品🍧 芒果糯米饭：泰餐收尾必点，只要芒果🥭不酸就不会难吃哈哈哈哈 （不喜欢那个coconut pudding，甜冰淇淋+咸花生的搭配不能理解） 地址 📍 2062 N Damen Ave, Chicago, IL 60647 餐厅🍴 Eat Fine Design By Khun Kung ",7, #宝藏餐厅分享 #餐厅推荐 #全球吃喝小分队 #泰国菜 #芝加哥生活 #芝加哥泰餐 #芝加哥探店 #芝加哥必吃榜 #吃吃喝喝玩玩乐乐 #榴莲爱好者,Eat Fine Design By Khun Kung,,2,1,nan,2024-04-16,2009,291,372,15,芝加哥泰餐｜榴莲+鸭肉荔枝咖喱，能不香？ - 小红书,,,medium,0.33748133399701347,False,0.1448481831757093,0.18516674962667995,0.007466401194624191,Tuesday,False,medium,0.018970189701897018
Hybrid,0,1,617,1,1,又是和老姐妹一起去的MicPookie（如果你碰巧刷到她的推荐，我们俩不是推广！！实话！！！！） 写在前面：非常好吃！！！！不咸！无科技添加美食（本科技雷达认证）！养生唱K！ 这地好像googlemap都不太好找，不知道是新开还是开了很久，每次去超市的时候都会路过，但门脸真的哈哈哈哈哈哈哈哈，谁看谁疑惑，很庆幸我俩的芝加哥老饕朋友（），让我俩带着疑惑走了进去。 先说吃的： 🍲煲仔饭: 好吃！开盖就可以闻到香气，米饭粒粒分明但不干巴，锅巴焦香。除了广式甜口腊肉腊肠，还有一些零星几个咸腊肉（or 腊鱼 or腊鸡），我不吃太咸的没仔细品，但是咸腊肉的搭配让整个煲仔饭的层次upup！怒吃三碗！ 乳鸽：实不相瞒，第一次吃乳鸽，地地道道是广东人说的 但鸽子外皮酥脆，咬下去皮肉分离的刹那间会弹出汁水，是好吃的！ 陈皮排骨：豪赤！豪赤！！陈皮味吃起来比闻起来淡，所以依旧保留排骨自带的肉香，搭配的很好，轻微甜口！炸制火候到位，汁水保留充足！很豪赤！！！ 古法盲曹：比清蒸的贵两块哈哈哈，的确也是第一次见到这么清蒸鱼加了木耳胡萝卜香菇，整体非常balance！鱼肉不腥，清甜！ 不知道是不是年纪大了，吃一些外面的饭会感觉到很明显的不适，这家完全没有！！！！！是我以后还会去的餐厅！ 他家还可以边吃饭边唱歌，年纪真的是大了，12点生物钟自然困，真的不适合专门去唱歌喝8+1，第二天昏昏沉沉，所以边唱歌边吃饭的包间太合适了，吃完唱几个小时，消食又养生 写在后面：他家完全不是漂亮饭的路子，是穿着hoodie和姐妹饱餐一顿大唱几首解压放松的地方！,7,#适合父母辈的宝藏餐厅 #芝加哥 #芝加哥美食 #芝加哥吃喝玩乐 #芝加哥生活,Feng Huang Lan Kwin Fong Bar and Grill,Chinese,1,1,nan,2026-01-23,171,264,358,31,Googlemap都找不到的芝加哥地道粤菜！ - 小红书,,,long,3.818713450292398,True,1.543859649122807,2.0935672514619883,0.18128654970760233,Friday,False,medium,0.011345218800648298
Hybrid,1,1,192,1,0,咱就说这家店我期盼了好几个月了，自从挂上招牌我就开始看啥时候开业！昨天出去觅食，突发奇想来看一眼，居然已经开业十几天了～ 啊啊啊啊啊 居然有麻辣烫！价格在P6！ 我家两大两小两碗粉（榨菜肉丝和牛杂P4），再加麻辣烫，一共消费58！真是适合我们家小鸡胃！5555 主要是有我最爱的素鸡肠，藕丸子！啊哈哈哈哈 开心 上一次吃这样的麻辣烫已经是8年前了！ 我猜地址是2512 S Halsted St或者2514？反正在tecake隔壁，就是那个常德牛肉粉。 ,6,#麻辣烫,Changde Vermicelli,Chinese,1,2,nan,2026-01-19,75000,136,160,12,https://www.xiaohongshu.com/explore/696e8077000000001a0366fd?app_platform=ios&app_version=9.21&share_from_user_hidden=true&xsec_source=app_share&type=normal&xsec_token=CBg8kgp977rtrUcuvtnGn9d3t72SWQDNDOgXn829inUfg=&author_share=1&xhsshare=WeixinSession&shareRedId=N0dHOTpHPEFIOElDOjw1TDlHQTdKOj9P&apptime=1773503616&share_id=b10244bfcf01440f8728e5f35dac8f27,,,short,0.0041066666666666665,False,0.0018133333333333332,0.0021333333333333334,0.00016,Monday,False,small,0.03125
Hybrid,0,1,418,1,1,"第一次吃的午饭没吃到烧鸟 大馋美女直接就是再去吃一个晚饭！没想到最好吃的是一碗乌冬面😭 借鉴黑麒麟点评 老师们的点评系统 我们打出了一个 8.35 (服务8 环境8.25 味道8.6) 🍜Maze soba 肉臊干乌冬🌟🌟🌟🌟🌟 （忘拍照了可恶啊啊啊） - 心中之最 吃了清新的鱼生之后再吃一口油润的肉臊乌冬面拌上生蛋黄 再加上木鱼花和葱花 嘴巴里面和口水打架！ 🍱Ikura uni don 海胆鱼子金枪鱼饭🌟🌟🌟🌟✨ -豪华的新鲜食材很难不好吃 超级鲜甜 米饭上还有一层海苔粉 层次感拉满 🐟Eel 鳗鱼烧鸟 🌟🌟🌟🌟 - 超新鲜的绵软鳗鱼 一定要趁热吃 酱汁有一点甜 如果不接受的话要避雷 🥩 Tteokgalbi 烤牛肉丸 🌟🌟🌟🌟 - 用牛肋排绞成的长肉丸做的 汁水超级充盈 薄薄的甜口酱汁 但是属于本北方人可以接受的程度 🦐Botan ebi shooter 甜虾鱼籽shot 🌟🌟🌟✨ -甜虾 鲑鱼子 和生鹌鹑蛋的组成 打底的是酸微甜的酱汁 配上新鲜食材超级清爽 就是分量太小了 不介意性价比的值得一试 🐠black cod misoyaki 鳕鱼味增烧 🌟🌟🌟 -吃到了大渔铁板烧的味道！ 🐂Beef tongue 👅 🌟🌟🌟 - 经典牛舌味道 不会出错的选择 💣可以不点的： NEGIMA（京葱鸡肉串）普通味道 TSUKUNE （鸡肉丸串）有点柴没必要 店名：TenGoku Aburiya 651 W Washington Blvd, Chicago, IL 60661 ",8,#芝加哥 #芝加哥美食 #留学生干饭 #烧鸟 #刺身 #干饭 #日料,TenGoku Aburiya,Japanese,2,1,nan,2026-01-09,48,233,262,5,芝加哥｜ 还有谁没吃过这家日料！ - 小红书,,,long,10.416666666666666,True,4.854166666666667,5.458333333333333,0.10416666666666667,Friday,False,medium,0.019138755980861243
Hybrid,0,0,277,3,0,上个vlog视频提到的可露丽连吃两个。 新品牛排法式蘸酱三明治真的也很好吃。我这个口味很不美式的都被这搭配了薯条的三明治征服了。设计上很make sense很聪明。作为一个蘸酱三明治，做到了吃的时候不脏手：餐厅做的法棍特意松软的内馅和crust的比例调高，crust比正常的要薄，看起来体积大有食欲，上手后很轻松地能把里面多汁的rib eye夹住，巧妙利用了薯条增加能够吸汁的体积，一口下去真的太满足了，脂香四溢。灵感应该来自于法国人本身就爱法棍蘸着浓汤吃。 🥐万圣节的主题菜单里有黑芝麻莓果可颂，意大利风格的酱料内馅可颂我还是喜欢基础款的法式可颂。酱料往往就盖过了黄油的纯粹美好哈哈。但是客观来讲好吃的。,12,#brunch #芝加哥美食 #法餐 #可露丽 #太好吃了吧 #obelix #芝加哥bakery #法棍三明治 #法国鹅肝 #万圣节菜单,Obelix,French,3,2,nan,2024-11-15,6921,452,403,16,芝加哥Obelix鹅肝可露丽..咸甜永动机 - 小红书,,,medium,0.12584886577084237,False,0.06530848143331888,0.058228579685016615,0.002311804652506863,Friday,False,medium,0.04332129963898917
Hybrid,0,0,153,2,0,"一直很喜欢吃马来西亚菜 最近知道芝加哥也有一家评分不错的餐厅 那必须冲哈哈哈 点了海南鸡饭 沙爹肉串 laksa汤面 还有甜点椰子冻！（有点甜）🥥 海南鸡饭绝绝子！鸡肉超级嫩 一定要蘸底下的咸鲜汤汁一起吃 都没有柴的肉，打包回家还是一样好吃 而且一份的量超级足 够两个人吃饱 鸡油饭也不错，真材实料大家一定要去吃！ Serai 📍地址：2169 N Milwaukee Ave, Chicago, IL 60647 ",3,#芝加哥美食 #芝加哥探店,Serai,Filipino,2,2,nan,2022-05-23,788,353,475,13,芝加哥最好吃的鸡 被我找到啦？ - 小红书,,,short,1.0672588832487309,True,0.4479695431472081,0.6027918781725888,0.01649746192893401,Monday,False,small,0.0196078431372549
Hybrid,0,0,80,2,0,怎么有这么惊为天人好吃的餐厅 不多说了 每一道都好吃 💡桥底龙虾 💡叻沙花蚬 💡东坡肉 💡蟹肉豆苗 💡清蒸鲈鱼 虽然这家店在xhs上不火 但真的很好吃啊啊啊啊啊 四个人吃完都赞不绝口😍😍😍,5,#芝加哥中餐 #芝加哥探店 #芝加哥美食 #芝加哥海鲜 #芝加哥餐厅 ,Go 4 Food,Chinese,2,1,nan,2025-11-10,460,294,346,22,芝加哥巨好吃的海鲜中餐馆Go 4 Food - 小红书,,,short,1.4391304347826086,True,0.6391304347826087,0.7521739130434782,0.04782608695652174,Monday,False,small,0.0625
Hybrid,0,1,217,1,0,"店名: Arvin restaurant 地址: 8482 W Golf Rd, Niles, IL 60714 P1 羊杂汤，用料扎实，有羊肠，羊血之类的，不过是有点羊味的。 P2 真的香惨了😭朋友们，第一次吃到香香嫩嫩软软原味的牛肉，绝了，肉香非常浓郁。 P3 每桌都点了，也超好吃，炸的面点？内馅儿是羊肉的，里面还有很多汤汁。 店里每个菜分量都很大，性价比贼高。Plus 老板蒙古人，非常可爱，英文不太好，但是非常热情，一顿比划的给你介绍。然后每桌还会上咸奶茶？挺好喝的，整体来说，真的是宝藏小店，绝对会再去很多次(下次可能会自带辣椒酱🌶️ ",4,,Arvin restaurant,Mongolian,1,3,nan,2024-10-25,77,287,354,18,芝加哥| 宝藏蒙餐 - 小红书,,,medium,8.558441558441558,True,3.727272727272727,4.597402597402597,0.23376623376623376,Friday,False,small,0.018433179723502304
